form_code,title,last_updated,form_page_url,pdf_url,how_to_fill_instructions
CIT 0001,Application for a Citizenship Certificate(opens in a new tab),2022-12,https://www.canada.ca/en/immigration-refugees-citizenship/services/application/application-forms-guides/cit0001.html,https://www.canada.ca/content/dam/ircc/documents/pdf/english/kits/forms/cit0001/01-12-2022/cit0001e.pdf,"Complete the form
Read the instructions on pages 9 to 13 of the application form for details on how to complete it.
Tips to help you complete the form
If a section does not apply to you, write “Not Applicable” or “NA”. If your application is incomplete it may be returned to you and this will delay processing.
If you’re completing this application for a minor under 18 years of age, remember all questions are about the minor and you should answer as though you are the minor.
If you need more space to answer any questions, use an extra sheet of paper and indicate the number and/or letter of the question you’re answering.
All of your answers must be complete and true."
