form_code,title,last_updated,form_page_url,pdf_url,how_to_fill_instructions
IMM 5457,Document Checklist: Atlantic High-Skilled Program(opens in a new tab),2022-03,https://www.canada.ca/en/immigration-refugees-citizenship/services/application/application-forms-guides/imm5457.html,https://www.canada.ca/content/dam/ircc/documents/pdf/english/kits/forms/imm5457/01-03-2022/imm5457e.pdf,"Complete the checklist How to use and submit this checklist As you gather documents and complete forms, check the boxes beside each item. When you put together your application package, place your documents and forms in the order shown on the checklist.Place the completed checklist on top of your application package before mailing it."
IMM 5467,Document Checklist: Atlantic Intermediate-Skilled Program(opens in a new tab),2022-03,https://www.canada.ca/en/immigration-refugees-citizenship/services/application/application-forms-guides/imm5467.html,https://www.canada.ca/content/dam/ircc/documents/pdf/english/kits/forms/imm5467/01-03-2022/imm5467e.pdf,"Complete the checklist How to use and submit this checklist As you gather documents and complete forms, check the boxes beside each item. When you put together your application package, place your documents and forms in the order shown on the checklist.Place the completed checklist on top of your application package before mailing it."
IMM 5475,Authority to Release Personal Information to a Designated Individual(opens in a new tab),2021-05,https://www.canada.ca/en/immigration-refugees-citizenship/services/application/application-forms-guides/imm5475.html,https://www.canada.ca/content/dam/ircc/documents/pdf/english/kits/forms/imm5475/16-12-2022/imm5475e.pdf,"Complete the checklist How to use and submit this checklist As you gather documents and complete forms, check the boxes beside each item. When you put together your application package, place your documents and forms in the order shown on the checklist.Place the completed checklist on top of your application package before mailing it."
IMM 5476,Use of a Representative Form(opens in a new tab),2025-05,https://www.canada.ca/en/immigration-refugees-citizenship/services/application/application-forms-guides/imm5476.html,https://www.canada.ca/content/dam/ircc/documents/pdf/english/kits/forms/imm5476/01-05-2025/imm5476e.pdf,"Complete the form
Read the step by step instructions on how to complete the form.
When to use this form
Complete this form only if you are:
appointing a representative;
updating contact information for your previously appointed representative;
cancelling a representative’s appointment;
cancelling the appointment of a representative and appointing a new representative; or
withdrawing your role as a representative
If you have dependent children aged 18 years or older, they are required to complete their own copy of this form if a
representative is also conducting business on their behalf.
Who is a representative?
A representative is someone who provides advice, consultation, or guidance to you at any stage of
the application process, or in a proceeding and, if you appoint them as your representative by filling out this
form, has your permission to conduct business on your behalf with Immigration, Refugees and Citizenship Canada
(IRCC) and the Canada Border Services Agency (CBSA).
You are not obliged to hire a representative. We treat everyone equally, whether they use the service of a
representative or not.
When you appoint a representative:
you also authorize IRCC and CBSA to share information from your application with this person in place of you.
Please note the representative will receive all correspondence from IRCC or the CBSA, not the
applicant;
your application will not be given special attention nor can you expect faster processing or a more favourable
outcome;
the representative is authorized to represent you only on citizenship or immigration matters related to the
application you submit with this form; and
you can appoint only one (1) representative at a time for each application you submit.
Important information: Notify IRCC about any changes.
You must notify IRCC if your representative’s contact information changes, or if you change your representative, or
cancel the appointment of your representative. For more information on updating IRCC with your representative’s
information, please see the section “How to submit this form” below.
Types of representatives
There are two (2) types of representatives.
Unpaid representatives
Unpaid representatives do not charge fees or receive any other form of consideration or compensation for providing
advice or services to represent you before IRCC or the CBSA.
Unpaid representatives include:
Friends, family members or other third parties who do not, and will not, charge a fee or receive any other
consideration for their advice and services;
consultants, lawyers and Quebec notaries, and students-at-law under their supervision, who do not, and will not,
charge a fee or receive any other consideration to represent you.
Note: You do not have to pay someone for them to be your representative. IRCC will conduct
business with an unpaid representative if an applicant appoints them on their behalf.
Paid representatives
Paid representatives charge a fee or receive some other form of consideration or compensation in exchange for the representation
that they provide.
It is important to know that anyone who represents or advises you for payment - or offers to do so - in connection
with IRCC proceedings or applications is breaking the law unless they are an authorized
representative or they have a specific agreement or arrangement with the Government of Canada that allows them to
represent or advise you. This applies to advice or consultation which happens before or after a citizenship or an
immigration application is made or a proceeding begins.
IRCC will only conduct business with paid representatives who are in good standing with their designated regulatory
body. Find
out if your representative is authorized.
Note: If a representative is being paid or compensated by someone other than you, the
representative is still considered to be a paid representative.
Paid representatives are:
consultants who are members in good standing of the College of Immigration and Citizenship Consultants (CICC);
lawyers and paralegals who are members in good standing of a Canadian provincial or territorial law society, and
students-at-law under their supervision;
notaries who are members in good standing of the Chambre des notaires du Québec and
students-at-law under their supervision.
If you appoint a paid representative who is not a member in good standing of one of these designated bodies,
your application will be returned. Learn
about using a representative.
Release of information to other individuals
To authorize IRCC to release information from your application to someone other than a representative, you will need to complete the form Authority to Release Personal Information to a Designated Individual (IMM 5475)  (opens in new tab) .
The person you designate under that form (IMM 5475) will be able to obtain information on your application, such as the status. However, they will not be able to conduct business on your behalf with IRCC.
Show instructions
Hide instructions
Expand all
Collapse all
General application information
Appoint a representative
Check box to indicate if you are appointing a representative to represent you with your application
process. Complete sections A, B and E.
Update contact information of an appointed representative
Check box to indicate if you are updating the contact information of a previously appointed representative. Complete sections A, B and E.
Cancel a representative
Check box to indicate if you are cancelling a representative. Complete sections A, C and E.
Cancel a representative and appoint a new representative
Check box to indicate if you are cancelling a representative and appointing a new representative. Complete sections A, B, C and E.
Withdrawing role as a representative
Check box to indicate if you are the representative and withdrawing yourself. Complete sections A, D and E; and
Sign the declaration in section D if you are unable to obtain applicant signature in section E.
Note: if you are both cancelling a representative and appointing a new one please check the appropriate box. Complete sections A, B, C and E.
Section A – Applicant Information
Question 1
Write your last name (surname or family name) and given name(s).
Question 2
Write your date of birth.
Question 3
Write your email address. If you have no email address, provide other contact information, such as a phone number.
Question 4
If you have already submitted your application, write:
The type of application you have submitted;
The Application number (if known)
Question 5
Write your IRCC’s Identification (ID) or Unique Client Identifier (UCI) number (if known). If you
have not dealt with IRCC since 1973, you will not have a UCI or a Client ID.
Section B – Appointment of Representative
Question 6
Write your representative’s full name.
If your representative is a member of the College of Immigration and Citizenship Consultants (CICC),
a law society in Canada or the Chambre des notaires du Québec, write their name as it appears on the organization’s
membership list.
Question 7
Check one box to indicate if your representative is unpaid or paid.
If your representative is authorized, write the membership ID number of:
the College of Immigration and Citizenship
Consultants (CICC); or
a Canadian
provincial or territorial law society; or
the Chambre des notaires du Québec.
Question 8
Write your representative’s contact information.
If you are appointing a student-at-law to represent you, include their supervising lawyer’s
information including their membership ID.
Question 9
To accept responsibility for conducting business on your behalf, your representative must:
Sign the declaration; and
Date the declaration.
If you are appointing a student-at-law to represent you, their supervising lawyer must also sign and date the declaration.
Section C – Cancel the Appointment of a Representative
Question 10
Fill in this sections if you wish to cancel the appointment of a representative. Write the
representative’s full name.
Complete sections A, B, C, and E of the form if you wish to both cancel a representative and appoint a
new one.
Section D – Withdrawing Role as a Representative
Question 11
The representative will fill in this section if they want to withdraw themselves as your representative.
To withdraw representation without applicant signature, your representative must:
Sign the declaration; and
Date the declaration.
Section E – Your Declaration
Question 12
By signing, you authorize IRCC to complete your request for yourself and your dependent children
under 18 years of age.
For sponsorship application, your spouse or common-law partner does not have to complete a separate
request. If your spouse or common-law partner is included in this request, they must sign in the box
provided.
For any other application, the representative is considered to be acting on behalf of the applicant identified in section A and (if applicable), their dependents. Separate authorization forms are required for a spouse or common-law partner even if they are included in the same application.
The form is signed by the applicant and representative submitted through a portal or secure account
Hand signature (also called a wet signature): Print and sign the form by hand.
E-Signature: Any type of insert on PDF forms:
Typed name
Adobe’s Fill & Sign or DocuSign (or other 3rd party app/software)
Scan or an image of a signature
Check box as indicated
Thumbprint: acceptable if a person is illiterate or cannot make a mark (e.g., an X) for a physical reason.
The form is signed by the applicant and representative submitted outside a portal or secure account
Hand signature (also called a wet signature): Print and sign the form by hand.
Note: This can be submitted via a scanned document.
Thumbprint: acceptable if a person is illiterate or cannot make a mark (e.g., an X) for a physical reason.
Release of information to other individuals
To authorize IRCC to release information from your application to someone other than a representative, you will need to complete the form Authority to Release Personal Information to a Designated Individual (IMM 5475)  (opens in new tab) .
The person you designate under that form (IMM 5475) will be able to obtain information on your application, such as the status of your application. However, they will not be able to conduct business on your behalf with IRCC.
How to submit this form
Online applications
If you have not yet submitted your immigration or citizenship application:
Upload this form along with your online application
If you have already submitted your immigration or citizenship application:
You may use this Web form to submit the IMM 5476 form.
Paper applications
If you have not yet submitted your immigration or citizenship application:
Send this form along with your application to the office listed in the guide of your application.
If you have already submitted your immigration or citizenship application:
You may use this Web form to submit the IMM 5476 form.
or;
If you know which IRCC office is processing your immigration or citizenship application, send the
completed form to the office mailing address. Consult IRCC
office mailing addresses.
You must notify IRCC about any changes in the information of the person you authorized to represent you on your application."
IMM 5481,Sponsorship Evaluation Form – Dependent Children(opens in a new tab),2020-10,https://www.canada.ca/en/immigration-refugees-citizenship/services/application/application-forms-guides/imm5481.html,https://www.canada.ca/content/dam/ircc/documents/pdf/english/kits/forms/imm5481/01-10-2020/imm5481e.pdf,"Complete the form
Read the step by step instructions on how to complete the form.
Show instructions
Hide instructions
Sponsorship Evaluation (IMM 5481)
Who needs to fill out this form?
The sponsor fills out this form if sponsoring only a dependent child who has no
dependent children of their own.
If sponsoring a dependent child who has dependent children of their own, fill out the Financial
Evaluation (IMM 1283) form instead.
The Sponsorship Evaluation will help us assess your past and current
obligations to any sponsorship undertakings you have signed or co-signed. This
form, and the supporting documents you send with your application will help us decide if you
meet the residency requirement and if you are able to support the applicant.
Quebec residents do not need to fill out this form.
Question 3
Write your net (after taxes) personal income for the 12 months
before the date of your application. Also write the dates of that 12-month
period.
Question 5 A and B
Details of current and past undertakings.
Write the number of people included in undertakings in effect and not yet in effect.
If you have signed undertakings in the past, you must give some details about
them. Follow the instructions on the form and be specific.
Question 6
Write the number of people you are financially responsible for, but who are not listed in
questions 5A and 5B, if it applies to you.
Question 7
Add the number of people listed in questions 4, 5 and 6. Write the total in the box
provided."
IMM 5483,Document Checklist: Study Permit(opens in a new tab),2025-08,https://www.canada.ca/en/immigration-refugees-citizenship/services/application/application-forms-guides/imm5483.html,https://www.canada.ca/content/dam/ircc/documents/pdf/english/kits/forms/imm5483/01-08-2025/imm5483e.pdf,"Complete the checklist How to use and submit this checklist As you gather documents and complete forms, check the boxes beside each item. When you put together your application package, place your documents and forms in the order shown on the checklist.Place the completed checklist on top of your application package before mailing it."
IMM 5484,Document Checklist: Temporary Resident Visa (Visitor Visa) outside of Canada(opens in a new tab),2024-07,https://www.canada.ca/en/immigration-refugees-citizenship/services/application/application-forms-guides/imm5484.html,https://www.canada.ca/content/dam/ircc/documents/pdf/english/kits/forms/imm5484/08-07-2024/imm5484e.pdf,"Complete the checklist How to use and submit this checklist As you gather documents and complete forms, check the boxes beside each item. When you put together your application package, place your documents and forms in the order shown on the checklist.Place the completed checklist on top of your application package before mailing it."
IMM 5488,Document Checklist: Work Permit (Applied outside Canada)(opens in a new tab),2024-10,https://www.canada.ca/en/immigration-refugees-citizenship/services/application/application-forms-guides/imm5488.html,https://www.canada.ca/content/dam/ircc/documents/pdf/english/kits/forms/imm5488/01-10-2024/imm5488e.pdf,"Complete the checklist How to use and submit this checklist As you gather documents and complete forms, check the boxes beside each item. When you put together your application package, place your documents and forms in the order shown on the checklist.Place the completed checklist on top of your application package before mailing it."
IMM 5492,Sponsor Assessment Form(opens in a new tab),2023-10,https://www.canada.ca/en/immigration-refugees-citizenship/services/application/application-forms-guides/imm5492.html,https://www.canada.ca/content/dam/ircc/documents/pdf/english/kits/forms/imm5492/01-10-2023/imm5492e.pdf,"Complete the form
Read the step by step instructions on how to complete the form.
Show instructions
Hide instructions
Sponsor Assessment (IMM 5492)
If you’re applying under Sponsorship Agreement Holders
Who must fill out this application form?
This form must be completed by the:
Sponsorship Agreement Holder (SAH) – (unless the form is kept on file with IRCC)
Constituent Group (if applicable)
What is it?
All persons who intend to sponsor refugees must meet the sponsor eligibility criteria established
by the Immigration and Refugee Protection Regulations. Each party to the sponsorship
(those who sign the undertaking) must complete the Sponsor
Assessment to confirm their eligibility.
Individuals who are deemed ineligible to sponsor will have their applications returned to them.
If you wish to clarify your response to a certain question, provide details on a separate sheet.
Group members may wish to submit their Sponsor Assessment in a sealed envelope to ensure
confidentiality. Be advised that the local IRCC office reserves the right to require official
documentation to support any aspect of your Sponsor Assessment.
Note: The representative of a Sponsorship Agreement Holder may complete the Sponsor Assessment form and submit it to IRCC National Headquarters to be kept on
file instead of having to complete the form for each sponsorship application.
Section A
Write the name of the sponsoring group (print clearly).
Section B
Write the last name (surname/family name) and given name(s) of the sponsor representative or
individual sponsor (print clearly).
Section C
Write any other name(s) used (including birth name, maiden, previous married name(s), aliases
and
nicknames) of the sponsor representative or individual sponsor (print clearly).
Section D
Check the box to indicate if you are at least 18 years of age or older.
Section E
Check the box to indicate if you are a Canadian citizen, a registered Indian or a permanent
resident.
Section F
Check the box to indicate if you or your representatives reside in the expected community of
resettlement.
Section G
Check the box if you have been convicted, in Canada of the offence of murder
or
an offence set out in the schedule I or II of the Corrections and Conditional
Release Act.
Or
Check the box if you have been convicted of an offence outside Canada that,
if
committed in Canada would constitute one of the offences referred to above.
Note: the schedules I and II are attached with the form.
Section H
Check the box to indicate if you are in default of any court-ordered support payment
obligations.
Section I
Check the box to indicate if you are currently detained in any penitentiary, jail,
reformatory or
prison.
Section J
Check the box to indicate if you have ever been ordered to leave Canada.
Section K
Check the box to indicate if you are subject to any revocation proceedings under the Citizenship Act.
Section L
Check the box to indicate if you authorize IRCC to disclose to the remaining parties that you cannot be a party to the sponsorship in the event that you are found to be ineligible.
Section M - Signature
Sign and date the form. If a signature is missing, the application may be returned.
See options for signing the sponsorship forms.
If you’re applying under Groups of Five
This form must be completed by each sponsor in a Group of Five.
Common errors when submitting
form was not submitted by each G5 sponsor
invalid version of form was submitted
not all questions were answered
form was handwritten
form was not signed and dated
Section A
Does not apply to G5 sponsors.
Section B
Type your family name and given names.
Section C
Type any other names you have used (including birth name, maiden name, previous married names, aliases and nicknames).
Section D to L
Check the appropriate box. If a box is not checked, the application may be returned.
Section M – Signatures
Sign and date the form. If a signature is missing, the application may be returned.
See options for signing the sponsorship forms.
If you’re applying under Community Sponsors
This form must be completed by:
the CS Signing Authority
the individual co-sponsor (if applicable)
the organizational co-sponsor Signing Authority (if applicable)
Common errors when submitting the form:
form was not submitted for each sponsor
invalid version of form was submitted
not all questions were answered
form was handwritten
form was not signed and dated
Section A
Type the name of the CS.
Section B
Type your family name and given names.
Section C
Type any other names you have used (including birth name, maiden name, previous married names, aliases and nicknames).
Section D to L
Check the appropriate box.
If a box is not checked, the application may be returned.
Section M – Signatures
Sign and date the form. If a signature is missing, the application may be returned.
See options for signing the sponsorship forms."
